{
  "schema_version": "bank-item.v1",
  "id": "mcf3m-m4-openstax-ia2e-ex959",
  "course_code": "MCF3M",
  "module": 4,
  "process_tags": [
    "complete-square-factor-a"
  ],
  "expectation_codes": [
    "A2.8"
  ],
  "placement_hint": "worked_example",
  "title": "OpenStax IA 2e Ex. 9.59: factor a = −3 before completing the square",
  "stem_student": "Rewrite f(x) = −3x^2 − 6x − 1 in the form f(x) = a(x − h)^2 + k by completing the square. Factor −3 from the x^2 and x terms first — do not complete the square as if a were 1.",
  "stem_teacher": "Named fracture: forgetting to factor a (brief misconception forget-factor-a). OpenStax §9.7 Example 9.59 is the worked a ≠ 1 rewrite. Keep the constant −1 outside the factor.",
  "answer": "f(x) = −3(x + 1)^2 + 2",
  "answer_verification": "Copied from OpenStax Intermediate Algebra 2e §9.7 Example 9.59 steps: factor −3 from the x terms; half of 2 is 1; the +1 inside is multiplied by −3 so add 3 outside; rewrite as −3(x + 1)^2 + 2. Author-checked: −3(x^2 + 2x + 1) − 1 + 3 = −3(x + 1)^2 + 2.",
  "checker_ref": null,
  "source": "openstax",
  "source_id": "openstax-ia2e-9-7-example-9-59",
  "source_url": "https://openstax.org/books/intermediate-algebra-2e/pages/9-7-graph-quadratic-functions-using-transformations",
  "licence": "CC BY-NC-SA 4.0",
  "attribution": "OpenStax Intermediate Algebra 2e, §9.7 Example 9.59 (Lynn Marecek, Andrea Honeycutt Mathis). CC BY-NC-SA 4.0. https://openstax.org/books/intermediate-algebra-2e/pages/1-introduction",
  "permitted_use_status": "non-commercial",
  "student_html_allowed": true,
  "review_status": "approved",
  "density_notes": null,
  "provenance_notes": "M4-L2 bank fill 2026-09-11. Dedicated a ≠ 1 fracture item. OpenStax warns to factor a from the x terms only, not the constant. Shawn selected→approved gate 2026-09-11 (PR #60)."
}
