{
  "schema_version": "bank-item.v1",
  "id": "mcf3m-m4-nelson-gs-p2-q7",
  "course_code": "MCF3M",
  "module": 4,
  "process_tags": ["inspect-vertex-form"],
  "expectation_codes": ["A2.10"],
  "placement_hint": "additional_practice",
  "title": "Vertex of y = −2(x + 3)^2 + 5 (h-sign)",
  "stem_student": null,
  "stem_teacher": null,
  "answer": null,
  "answer_verification": "Local Nelson bank item has no key. Focus on part (d) only; the full stem also asks for a transformation list (A2.5/A2.6, already taught).",
  "checker_ref": null,
  "source": "nelson_functions_11",
  "source_id": "NEL-C1-1GettingStarted-GS-p2-Q7",
  "source_url": null,
  "licence": "unknown (commercial textbook excerpt in local bank; licence not recorded in the bank file)",
  "attribution": null,
  "permitted_use_status": "excluded",
  "student_html_allowed": false,
  "review_status": "rejected",
  "density_notes": "Plus-inside h-sign diagnostic density: one vertex-form equation with (x + 3) so students who read the written plus as a right shift place the vertex at (3, k) instead of (−3, k). Use as density oracle only — do not print stem.",
  "provenance_notes": "From M4-L1 question-candidates diagnostic rank 1; practice-sequence placement additional_practice, visible_by_default false, exclusion_reason unknown commercial licence."
}
