{
  "schema_version": "bank-item.v1",
  "id": "mcf3m-m4-ontario-a26-example-0",
  "course_code": "MCF3M",
  "module": 4,
  "process_tags": [
    "inspect-vertex-form"
  ],
  "expectation_codes": [
    "A2.6",
    "A2.10"
  ],
  "placement_hint": "worked_example",
  "title": "Ministry A2.6 sample: vertex of −2(x + 1)^2",
  "stem_student": "Starting from y = x^2, sketch h(x) = −2(x + 1)^2. Where is the vertex? Does this graph have a maximum or a minimum?",
  "stem_teacher": "Reuse A2.6 seed sample for plus-inside + max/min misconception only; do not treat sketching-by-transformation as a new M4 target. Quote the seed sample; do not invent Ministry wording beyond the seed.",
  "answer": null,
  "answer_verification": "Seed has no key for this sample.",
  "checker_ref": null,
  "source": "ontario-seed",
  "source_id": "A2.6-example-0",
  "source_url": null,
  "licence": "Queen's Printer for Ontario (curriculum excerpt in verified seed)",
  "attribution": "lms/seeds/mcf3m_expectations.json",
  "permitted_use_status": "restricted",
  "student_html_allowed": true,
  "review_status": "approved",
  "density_notes": null,
  "provenance_notes": "From M4-L1 question-candidates diagnostic rank 3; practice-sequence worked_example for inspect-vertex-form (variation). Verbatim seed sample id A2.6-example-0."
}
