{
  "schema_version": "bank-item.v1",
  "id": "mcf3m-m4-mathnet-0gz2",
  "course_code": "MCF3M",
  "module": 4,
  "process_tags": [],
  "expectation_codes": ["A2.10"],
  "placement_hint": "unassigned",
  "title": "MathNet 0gz2 (olympiad; rewrite required)",
  "stem_student": null,
  "stem_teacher": "Contest stem is not classroom copy. Situation-level rewrite was proposed in M4-L1 candidates but not accepted for this lesson. Keep catalogue stem in source fields only.",
  "answer": "(-4, -1)",
  "answer_verification": "Copied from MathNet final_answer convenience field; LLM-assisted, not an official contest key. Do not treat as verified.",
  "checker_ref": null,
  "source": "mathnet",
  "source_id": "mathnet-0gz2",
  "source_url": "https://mathnet.mit.edu/explorer.html?id=0gz2",
  "licence": "CC BY 4.0 unless the contest/country asserts otherwise; see row country/competition",
  "attribution": "MathNet id 0gz2, 50th Mathematical Olympiad in Ukraine, Fourth Round (March 23, 2010), Ukraine. https://huggingface.co/datasets/ShadenA/MathNet.",
  "permitted_use_status": "unknown",
  "student_html_allowed": false,
  "review_status": "rejected",
  "density_notes": null,
  "provenance_notes": "From M4-L1 question-candidates transfer rank 3; practice-sequence placement excluded (excessive difficulty; licence not confirmed; unverified key). Catalogue record mathnet-0gz2."
}
