{
  "schema_version": "bank-item.v1",
  "id": "mcf3m-m4-nelson-gs-p2-q6",
  "course_code": "MCF3M",
  "module": 4,
  "process_tags": ["inspect-vertex-form"],
  "expectation_codes": ["A2.10"],
  "placement_hint": "additional_practice",
  "title": "Nelson: label vertex and axis from mixed equations",
  "stem_student": null,
  "stem_teacher": null,
  "answer": null,
  "answer_verification": "Local Nelson bank item has no key. Part (d) is standard form (vertex not readable by inspection alone); skip (d) if this lesson stays on vertex-form inspection, or keep it as a contrast.",
  "checker_ref": null,
  "source": "nelson_functions_11",
  "source_id": "NEL-C1-1GettingStarted-GS-p2-Q6",
  "source_url": null,
  "licence": "unknown (commercial textbook excerpt in local bank; licence not recorded in the bank file)",
  "attribution": null,
  "permitted_use_status": "excluded",
  "student_html_allowed": false,
  "review_status": "rejected",
  "density_notes": "Mixed vertex/axis labelling density: minus-inside, plus-inside with a < 0 (axis and max/min), plus a standard-form contrast item. Oracle for practice progression after diagnostic — do not print stem.",
  "provenance_notes": "From M4-L1 question-candidates practice rank 2; practice-sequence additional_practice, visible_by_default false, exclusion_reason unknown commercial licence."
}
