{
  "schema_version": "bank-item.v1",
  "id": "mcf3m-m4-ontario-a27-sample",
  "course_code": "MCF3M",
  "module": 4,
  "process_tags": ["expand-and-verify", "compare-two-equivalent-models"],
  "expectation_codes": ["A2.7"],
  "placement_hint": "core_practice",
  "title": "MCF3M A2.7 sample: expand 3(x − 1)^2 + 4",
  "stem_student": "Given f(x) = 3(x − 1)^2 + 4, write the same function as ax^2 + bx + c. Use graphing technology to compare the two graphs.",
  "stem_teacher": "Verbatim Ministry sample for A2.7 from verified seed. Do not invent the expanded coefficients.",
  "answer": null,
  "answer_verification": "Seed has no key for this sample.",
  "checker_ref": "content-builder/scripts/vertex_form_checker.py",
  "source": "ontario-seed",
  "source_id": "ontario-seed-mcf3m-A2.7-sample",
  "source_url": null,
  "licence": "Queen's Printer for Ontario (curriculum excerpt in verified seed)",
  "attribution": "lms/seeds/mcf3m_expectations.json",
  "permitted_use_status": "restricted",
  "student_html_allowed": true,
  "review_status": "selected",
  "density_notes": null,
  "provenance_notes": "From M4-L1 question-candidates guided_example rank 2; practice-sequence core_practice for expand-and-verify. Catalogue record ontario-seed-mcf3m-A2.7-sample."
}
