{
  "schema_version": "bank-item.v1",
  "id": "mcf3m-m4-openstax-m51274-verbal-q4-vertex-name",
  "course_code": "MCF3M",
  "module": 4,
  "process_tags": [
    "three-form-contrast"
  ],
  "expectation_codes": [
    "A2.10"
  ],
  "placement_hint": "guided_practice",
  "title": "OpenStax verbal: another name for their standard form",
  "stem_student": "OpenStax writes a quadratic as f(x) = a(x − h)^2 + k and calls that writing standard form. What other name does OpenStax give that same writing?",
  "stem_teacher": "OpenStax uses “standard form” for a(x − h)^2 + k and also calls it vertex form. Ontario uses vertex form for that expression and standard form for ax^2 + bx + c. Keep the OpenStax naming in the stem; add the Ontario note in teacher copy only. Source: College Algebra 2e §5.1 Verbal #4.",
  "answer": "Vertex form (of a quadratic function).",
  "answer_verification": "OpenStax §5.1 states that because the vertex appears in f(x) = a(x − h)^2 + k, that writing is also known as the vertex form of a quadratic function. Verbal exercise 4 asks for another name for their standard form.",
  "checker_ref": null,
  "source": "openstax",
  "source_id": "openstax-ca2e-m51274-verbal-4",
  "source_url": "https://openstax.org/books/college-algebra-2e/pages/5-1-quadratic-functions",
  "licence": "CC BY-NC-SA 4.0",
  "attribution": "OpenStax College Algebra 2e, Quadratic Functions (m51274) §5.1 Verbal #4. CC BY-NC-SA 4.0. https://openstax.org/details/books/college-algebra-2e",
  "permitted_use_status": "non-commercial",
  "student_html_allowed": true,
  "review_status": "approved",
  "density_notes": null,
  "provenance_notes": "Bank fill 2026-09-09: second licensed three-form-contrast item so module min_approved_items density can clear once Shawn approves. Paraphrase of OpenStax verbal #4 + section prose that names vertex form; no Nelson stems."
}
